{
  "page_number": 3,
  "chapter_id": "ch01",
  "is_chapter_start": false,
  "content_type": "chapter_body",
  "xhtml": "<p>are its mechanisms or component parts, and how are they organized? (3) What are the functions of the component parts and their organized structure—that is, what is the mind designed to do? (4) How does input from the current environment interact with the design of the human mind to produce observable behavior?</p><p>Contemplating the mysteries of the human mind is not new. Ancient Greeks such as Aristotle and Plato wrote manifestos on the subject. More recently, theories of the human mind such as the Freudian theory of psychoanalysis, the Skinnerian theory of reinforcement, and connectionism have vied for the attention of psychologists.</p><p>Only within the past few decades have we acquired the conceptual tools to synthesize our understanding of the human mind under one unifying theoretical framework—that of evolutionary psychology. This discipline pulls together findings from all disciplines of the mind, including those of brain imaging; learning and memory; attention, emotion, and passion; attraction, jealousy, and sex; self-esteem, status, and self-sacrifice; parenting, persuasion, and perception; kinship, warfare, and aggression; cooperation, altruism, and helping; ethics, morality, and medicine; and commitment, culture, and consciousness. This book offers an introduction to evolutionary psychology and provides a road map to this new science of the mind.</p><p>This chapter starts by tracing the major landmarks in the history of evolutionary biology that were critical in the emergence of evolutionary psychology. Then we turn to the history of the field of psychology and show the progression of accomplishments that led to the need for integrating evolutionary theory with modern psychology.</p><h2>LANDMARKS IN THE HISTORY OF EVOLUTIONARY THINKING</h2><p class=\"has-dropcap\"><span class=\"dropcap\">W</span>e begin our examination of the history of evolutionary thinking well before the contributions of Charles Darwin and then consider the various milestones in its development through the end of the twentieth century.</p><h3>Evolution before Darwin</h3><p>Evolution refers to change over time. Change in life forms was postulated by scientists to have occurred long before Darwin published his classic 1859 book, <em>On the Origin of Species</em> (see Glass, Temkin, &amp; Straus, 1959; and Harris, 1992, for historical treatments).</p><p>Jean Baptiste Pierre Antoine de Monet Chevalier de Lamarck (1744–1829) was one of the first scientists to use the word <em>biologie</em>, thus recognizing the study of life as a distinct science. Lamarck believed in two major causes of species change: first, a natural tendency for each species to progress toward a higher form and, second, the inheritance of acquired characteristics. Lamarck said that animals must struggle to survive and this struggle causes their nerves to secrete a fluid that enlarges the organs involved in the struggle. Giraffes evolved long necks, he thought, through their attempts to eat from higher and higher leaves (recent evidence suggests that long necks may also play a role in male competition). Lamarck believed that the neck changes that came about from these strivings were passed down to succeeding generations of giraffes, hence the phrase “the inheritance of acquired characteristics.” Another theory of change in life forms was developed by Baron Georges Léopold Chrétien Frédéric Dagobert Cuvier</p>",
  "images": [],
  "chrome_detected": [
    {
      "kind": "running_header",
      "text": "The Scientific Movements Leading to Evolutionary Psychology"
    },
    {
      "kind": "page_number",
      "text": "3"
    }
  ],
  "footnotes": [],
  "confidence": 0.98,
  "notes": "Single column text. Drop cap on the paragraph following the 'Landmarks' heading. No footnotes visible on this specific page despite book context warning."
}
