{
  "page_number": 4,
  "chapter_id": "ch01",
  "is_chapter_start": false,
  "content_type": "chapter_body",
  "xhtml": "<p>(1769–1832). Cuvier proposed a theory called <em>catastrophism</em>, according to which species are extinguished periodically by sudden catastrophes, such as meteorites, and then replaced by different species.</p><p>Biologists before Darwin also noticed the bewildering variety of species, some with astonishing structural similarities. Humans, chimpanzees, and orangutans, for example, all have exactly five digits on each hand and foot. The wings of birds are similar to the flippers of seals, perhaps suggesting that one was modified from the other (Daly &amp; Wilson, 1983). Comparisons among these species suggested that life was not static, as some scientists and theologians had argued. Further evidence suggesting change over time also came from the fossil record. Bones from older geological strata were not the same as bones from more recent geological strata. These bones would not be different, scientists reasoned, unless there had been a change in organic structure over time.</p><p>Another source of evidence came from comparing the embryological development of different species (Mayr, 1982). Biologists noticed that such development was strikingly similar in species that otherwise seemed very different from one another. An unusual loop-like pattern of arteries close to the branchial slits characterizes the embryos of mammals, birds, and frogs. This evidence suggested, perhaps, that these species might have come from the same ancestors millions of years ago. All these pieces of evidence, present before 1859, suggested that life was not fixed or unchanging. The biologists who believed that organic structure changed over time called themselves evolutionists.</p><p>Another key observation had been made by various evolutionists before Darwin. Many species possess characteristics that seem to have a purpose. The porcupine's quills help it fend off predators. The turtle's shell helps to protect its tender organs from the hostile forces of nature. The beaks of many birds are designed to aid in cracking nuts. This apparent functionality, so abundant in nature, required an explanation.</p><p>Missing from the evolutionists' accounts before Darwin, however, was a theory to explain how change might take place over time and how such seemingly purposeful structures such as the giraffe's long neck and the porcupine's sharp quills could have come about. A causal mechanism or process to explain these biological phenomena was needed. Charles Darwin provided the theory of just such a mechanism.</p><h2>Darwin's Theory of Natural Selection</h2><p>Darwin's task was more difficult than it might at first appear. He wanted not only to explain why change takes place over time in life forms, but also to account for the particular ways it proceeds. He wanted to determine how new species emerge (hence the title of his book, <em>On the Origin of Species</em>), as well as how others vanish. Darwin wanted to explain why the component parts of animals—the long necks of giraffes, the wings of birds, and the trunks of elephants—existed in those particular forms. And he wanted to explain the apparent purposeful quality of those forms, or why they seem to function to help organisms accomplish specific tasks.</p><p>The answers to these puzzles can be traced to a voyage Darwin took after graduating from Cambridge University. He traveled the world as a naturalist on a ship, the <em>Beagle</em>, for a five-year period, from 1831 to 1836. During this voyage, he collected dozens of samples of birds and other animals from the Galápagos Islands in the Pacific Ocean. On returning from his voyage, he discovered that the Galápagos finches, which he had presumed were all of the same species,</p>",
  "images": [],
  "chrome_detected": [
    {
      "kind": "running_header",
      "text": "The Scientific Movements Leading to Evolutionary Psychology"
    },
    {
      "kind": "page_number",
      "text": "4"
    }
  ],
  "footnotes": [],
  "confidence": 0.98,
  "notes": "Single column text. Italicized terms and book titles preserved. Section heading detected."
}
